### ISSUE TITLE
Docker Swarm Network Issues on arm64

### ISSUE THREAD

**Issue by tylerwight** [docker/for-linux#525]
* [x] This is a bug report
* [ ] This is a feature request
* [x] I searched existing issues before opening this one

### Expected behavior
Docker swarm mode routing mesh works as expected (on arm64), and if it does there is an error log on where it is failing

### Actual behavior
Docker swarm mode routing mesh does not work (on this specific arm64)  and it is hard to find where the fault is. 

### Steps to reproduce the behavior
1. Ubuntu 16.04 Xenial on a  2gb Pine64 single board computer
Fresh flash of  Ubuntu Xenial Minimal Pine64 bspkernel 0.7.9-104 found here: https://github.com/ayufan-pine64/linux-build/releases/tag/0.7.9 As far as the pine64 is concerened this is the ‘main’ ubuntu distribution as Ayufan as done tons of great work on this

2. Run this script to ready the device and install docker: https://github.com/tylerwight/SBC-Cluster/blob/master/Swarm/Pine64/pine64-init.sh 

3. (if using docker 18.09 you need to use this to get it start up, I have tried 18.03.01 and 18.09) https://github.com/docker/for-linux/issues/475

4. docker swarm init on master and docker swarm join on node.

5. start a service: “sudo docker service create --name transmission -p 9091:9091 -p 51413:51413/udp lsioarmhf/transmission-aarch64”

I can access it from the node it exists on, but the mesh network is not allowing me to view it from the other nodes

```
C:\Windows\System32>curl 10.100.1.151:9091
<h1>301: Moved Permanently</h1>
C:\Windows\System32>curl 10.100.1.148:9091
curl: (7) Failed to connect to 10.100.1.148 port 9091: Timed out

C:\Windows\System32>
```

**Output of `docker version`:**

```
pine64@master64:~$ sudo docker version
[sudo] password for pine64:
Client:
 Version:           18.09.0
 API version:       1.39
 Go version:        go1.10.4
 Git commit:        4d60db4
 Built:             Wed Nov  7 00:52:41 2018
 OS/Arch:           linux/arm64
 Experimental:      false

Server: Docker Engine - Community
 Engine:
  Version:          18.09.0
  API version:      1.39 (minimum version 1.12)
  Go version:       go1.10.4
  Git commit:       4d60db4
  Built:            Wed Nov  7 00:17:01 2018
  OS/Arch:          linux/arm64
  Experimental:     false

```

**Output of `docker info`:**

```
pine64@master64:~$ sudo docker info
Containers: 0
 Running: 0
 Paused: 0
 Stopped: 0
Images: 0
Server Version: 18.09.0
Storage Driver: aufs
 Root Dir: /var/lib/docker/aufs
 Backing Filesystem: extfs
 Dirs: 0
 Dirperm1 Supported: true
Logging Driver: json-file
Cgroup Driver: cgroupfs
Plugins:
 Volume: local
 Network: bridge host macvlan null overlay
 Log: awslogs fluentd gcplogs gelf journald json-file local logentries splunk syslog
Swarm: active
 NodeID: r6fls0jd8pzx2oyo9j3cy9dz3
 Is Manager: true
 ClusterID: oyj8kd4hm3avukbpag27va2q8
 Managers: 1
 Nodes: 4
 Default Address Pool: 10.0.0.0/8
 SubnetSize: 24
 Orchestration:
  Task History Retention Limit: 5
 Raft:
  Snapshot Interval: 10000
  Number of Old Snapshots to Retain: 0
  Heartbeat Tick: 1
  Election Tick: 10
 Dispatcher:
  Heartbeat Period: 5 seconds
 CA Configuration:
  Expiry Duration: 3 months
  Force Rotate: 0
 Autolock Managers: false
 Root Rotation In Progress: false
 Node Address: 10.100.1.148
 Manager Addresses:
  10.100.1.148:2377
Runtimes: runc
Default Runtime: runc
Init Binary: docker-init
containerd version: c4446665cb9c30056f4998ed953e6d4ff22c7c39
runc version: 4fc53a81fb7c994640722ac585fa9ca548971871
init version: fec3683
Security Options:
 apparmor
Kernel Version: 3.10.105-bsp-1.2-ayufan-104
Operating System: Ubuntu 16.04.2 LTS
OSType: linux
Architecture: aarch64
CPUs: 4
Total Memory: 981.3MiB
Name: master64
ID: XGL7:LGDZ:35GS:H3C3:6JGY:R6YR:HL6S:2TYS:IFY3:JFOG:SA6M:QNDB
Docker Root Dir: /var/lib/docker
Debug Mode (client): false
Debug Mode (server): false
Registry: https://index.docker.io/v1/
Labels:
Experimental: false
Insecure Registries:
 127.0.0.0/8
Live Restore Enabled: false
Product License: Community Engine

pine64@master64:~$


```

**Additional environment details (AWS, VirtualBox, physical, etc.)**

```
$uname -a
Linux master64 3.10.105-bsp-1.2-ayufan-104 #1 SMP PREEMPT Wed Aug 23 14:25:12 UTC 2017 aarch64 aarch64 aarch64 GNU/Linux
```

Environment: 4 pine64’s w/ 2gb of ram in a docker swarm cluster running docker 18.09 (tried 18.03 as well).

master = 10.100.1.148=master64
node 1 = 10.100.1.149=og64
node 2 = 10.100.1.150=pine16
node 3 = 10.100.1.151=pine32

```
pine64@master64:~$ sudo docker service ps transmission
ID                  NAME                IMAGE                                   NODE                DESIRED STATE       CURRENT STATE         ERROR               PORTS
pnfqrl0s4til        transmission.1      lsioarmhf/transmission-aarch64:latest   pine32              Running             Running 4 hours ago
pine64@master64:~$
```

I have tried this exact setup with 2 x86_64 VMs in swarm mode and it worked just fine right out of the box (could connect to services on node1 with master1's ip). I have spent a week or so trying to figure this out and I think that this is kernel module related, but I’m no t 100% sure. I also have tcp dumps and I can see traffic hitting 10.100.1.148 and see it attempting to forward to 10.100.1.151, and even see that traffic on 151 so I’m not sure ( I can paste those if needed.).

My issue sounds exactly like this one:

https://github.com/docker/libnetwork/issues/2227

That user is using a sister board to mine called the rock64, which is slightly newer but the kernel/Linux image is made by the same person Ayufan. I compared the lsmod of my devices with my x86 machines and these pine 64 boards and I am I can see some differences but I’m not sure which ones are significant.

In this case I believe this is a bug because I see zero errors in docker logs and have seen no warnings, etc. so I am unable to find the cause. 

I also could be missing something very simple, I am still new to docker, github, etc so apologies if this is in the wrong place.  Here is the lsmod output of my pine64 master node

```
pine64@master64:~$ lsmod
Module                  Size  Used by
nfnetlink_queue        18917  0
nfnetlink_log          18444  0
ip_vs_rr               12627  1
xt_ipvs                12594  1
ip_vs                 116732  4 ip_vs_rr,xt_ipvs
xt_nat                 12736  7
xt_tcpudp              12608  14
vxlan                  24533  0
iptable_mangle         12725  1
xt_mark                12534  3
ipt_MASQUERADE         12756  3
nf_conntrack_netlink    38130  0
nfnetlink              13637  4 nfnetlink_log,nf_conntrack_netlink,nfnetlink_queue
iptable_nat            12781  2
nf_conntrack_ipv4      20983  5
nf_defrag_ipv4         12564  1 nf_conntrack_ipv4
nf_nat_ipv4            13155  1 iptable_nat
xt_addrtype            12908  5
iptable_filter         12725  1
ip_tables              22654  3 iptable_filter,iptable_mangle,iptable_nat
xt_conntrack           12843  4
x_tables               26209  10 xt_ipvs,xt_mark,ip_tables,xt_tcpudp,ipt_MASQUERADE,xt_conntrack,xt_nat,iptable_filter,iptable_mangle,xt_addrtype
nf_nat                 24670  4 ipt_MASQUERADE,nf_nat_ipv4,xt_nat,iptable_nat
nf_conntrack           86435  8 ip_vs,ipt_MASQUERADE,nf_nat,nf_nat_ipv4,xt_conntrack,nf_conntrack_netlink,iptable_nat,nf_conntrack_ipv4
bridge                109019  0
aufs                  225690  0
vfe_v4l2              772828  0
videobuf2_dma_contig    20341  1 vfe_v4l2
ir_lirc_codec          13350  0
videobuf2_memops       12600  1 videobuf2_dma_contig
ir_sony_decoder        12786  0
ir_sanyo_decoder       12869  0
ir_mce_kbd_decoder     13330  0
lirc_dev               18895  1 ir_lirc_codec
ir_jvc_decoder         12811  0
ir_rc6_decoder         12871  0
ir_rc5_decoder         12757  0
videobuf2_core         35245  1 vfe_v4l2
vfe_io                 44013  1 vfe_v4l2
ir_nec_decoder         12892  0
sunxi_ir_rx            14684  0
ss                     41661  0
cedar_ve               20392  0
mali                  287546  0
8723cs               1227342  0
8723bs               1496864  0
hall                   14030  0
hdmi                   56470  0
disp                 1132280  2 hdmi
hci_uart               31036  0
bluetooth             217400  1 hci_uart
8723bs_vq0           1501780  0
cfg80211              430891  3 8723bs_vq0,8723bs,8723cs
pine64@master64:~$

```

**Comment by tylerwight** [comment]
Here is the lsmod output of a working (mesh network is working) swarm cluster built in x86 VMs. I used virtually the same steps for install as the pine64 board, just for x86.

```
user@DockerMaster1:~$ sudo lsmod
Module                  Size  Used by
ip_vs_wrr              16384  0
xt_REDIRECT            16384  3
nf_nat_redirect        16384  1 xt_REDIRECT
ip_vs_rr               16384  1
xt_ipvs                16384  1
ip_vs                 147456  6 ip_vs_rr,xt_ipvs,ip_vs_wrr
xt_nat                 16384  13
xt_tcpudp              16384  29
veth                   16384  0
vxlan                  49152  0
ip6_udp_tunnel         16384  1 vxlan
udp_tunnel             16384  1 vxlan
iptable_mangle         16384  1
xt_mark                16384  4
ipt_MASQUERADE         16384  3
nf_nat_masquerade_ipv4    16384  1 ipt_MASQUERADE
nf_conntrack_netlink    40960  0
nfnetlink              16384  2 nf_conntrack_netlink
xfrm_user              32768  1
xfrm_algo              16384  1 xfrm_user
iptable_nat            16384  3
nf_conntrack_ipv4      20480  12
nf_defrag_ipv4         16384  1 nf_conntrack_ipv4
nf_nat_ipv4            16384  1 iptable_nat
xt_addrtype            16384  5
iptable_filter         16384  2
ip_tables              24576  3 iptable_filter,iptable_mangle,iptable_nat
xt_conntrack           16384  11
x_tables               36864  11 xt_ipvs,xt_mark,ip_tables,xt_tcpudp,ipt_MASQUERADE,xt_conntrack,xt_nat,iptable_filter,xt_REDIRECT,iptable_mangle,xt_addrtype
nf_nat                 28672  4 nf_nat_redirect,nf_nat_ipv4,xt_nat,nf_nat_masquerade_ipv4
nf_conntrack          106496  7 ip_vs,nf_nat,nf_nat_ipv4,xt_conntrack,nf_nat_masquerade_ipv4,nf_conntrack_netlink,nf_conntrack_ipv4
br_netfilter           24576  0
bridge                126976  1 br_netfilter
stp                    16384  1 bridge
llc                    16384  2 stp,bridge
ufs                    73728  0
qnx4                   16384  0
hfsplus               106496  0
hfs                    57344  0
minix                  36864  0
ntfs                   98304  0
msdos                  20480  0
jfs                   180224  0
xfs                   978944  0
aufs                  217088  0
overlay                49152  1
shpchp                 36864  0
input_leds             16384  0
serio_raw              16384  0
joydev                 20480  0
i2c_piix4              24576  0
mac_hid                16384  0
ib_iser                49152  0
rdma_cm                49152  1 ib_iser
iw_cm                  45056  1 rdma_cm
ib_cm                  45056  1 rdma_cm
ib_sa                  36864  2 rdma_cm,ib_cm
ib_mad                 49152  2 ib_cm,ib_sa
ib_core               106496  6 rdma_cm,ib_cm,ib_sa,iw_cm,ib_mad,ib_iser
ib_addr                20480  2 rdma_cm,ib_core
iscsi_tcp              20480  0
libiscsi_tcp           24576  1 iscsi_tcp
libiscsi               53248  3 libiscsi_tcp,iscsi_tcp,ib_iser
scsi_transport_iscsi   102400  4 iscsi_tcp,ib_iser,libiscsi
autofs4                40960  2
btrfs                 991232  0
raid10                 49152  0
raid456               110592  0
async_raid6_recov      20480  1 raid456
async_memcpy           16384  2 raid456,async_raid6_recov
async_pq               16384  2 raid456,async_raid6_recov
async_xor              16384  3 async_pq,raid456,async_raid6_recov
async_tx               16384  5 async_pq,raid456,async_xor,async_memcpy,async_raid6_recov
xor                    24576  2 btrfs,async_xor
raid6_pq              102400  4 async_pq,raid456,btrfs,async_raid6_recov
libcrc32c              16384  3 xfs,raid456,ip_vs
raid1                  36864  0
raid0                  20480  0
multipath              16384  0
linear                 16384  0
hid_generic            16384  0
usbhid                 49152  0
hid                   122880  2 hid_generic,usbhid
psmouse               131072  0
virtio_scsi            20480  2
pata_acpi              16384  0
floppy                 73728  0
user@DockerMaster1:~$
```

**Comment by tylerwight** [comment]
Here is some traffic I capture. I ran 'tcpdump -vn' on each node at the same time (filtering out ssh traffic). While running I quickly attempted to reach my service at 10.100.1.148:9091 and got nothing. Then after some time I requested it directly from the node it is on (10.100.1.151:9091) and it pulled up just fine. In both instances I can see the traffic make to to node 151 in some form

tcpdump on master. filtering only for lines that contain '10.100.1.151'

```
    10.100.1.151.7946 > 10.100.1.148.7946: UDP, length 58
    10.100.1.148.7946 > 10.100.1.151.7946: UDP, length 49
    10.100.1.148.7946 > 10.100.1.151.7946: UDP, length 58
    10.100.1.151.7946 > 10.100.1.148.7946: UDP, length 49
    10.100.1.151.7946 > 10.100.1.148.7946: UDP, length 58
    10.100.1.148.7946 > 10.100.1.151.7946: UDP, length 49
    10.100.1.148.35429 > 10.100.1.151.4789: VXLAN, flags [I] (0x08), vni 4096
    10.100.1.151 > 10.100.1.148: ICMP 10.100.1.151 udp port 4789 unreachable, length 110
    10.100.1.151 > 10.100.1.148: ICMP 10.100.1.151 udp port 4789 unreachable, length 110
    10.100.1.148.35429 > 10.100.1.151.4789: VXLAN, flags [I] (0x08), vni 4096
    10.100.1.148.58621 > 10.100.1.151.4789: VXLAN, flags [I] (0x08), vni 4096
    10.100.1.151 > 10.100.1.148: ICMP 10.100.1.151 udp port 4789 unreachable, length 110
    10.100.1.151 > 10.100.1.148: ICMP 10.100.1.151 udp port 4789 unreachable, length 110
```

on node filtering only for lines that contain '10.100.1.148':

```
    10.100.1.151.7946 > 10.100.1.148.7946: UDP, length 58
    10.100.1.148.7946 > 10.100.1.151.7946: UDP, length 49
    10.100.1.148.7946 > 10.100.1.151.7946: UDP, length 58
    10.100.1.151.7946 > 10.100.1.148.7946: UDP, length 49
    10.100.1.151.7946 > 10.100.1.148.7946: UDP, length 58
    10.100.1.148.7946 > 10.100.1.151.7946: UDP, length 49
    10.100.1.148.35429 > 10.100.1.151.4789: VXLAN, flags [I] (0x08), vni 4096
    10.100.1.151 > 10.100.1.148: ICMP 10.100.1.151 udp port 4789 unreachable, length 110
    10.100.1.148.35429 > 10.100.1.151.4789: VXLAN, flags [I] (0x08), vni 4096
    10.100.1.148.58621 > 10.100.1.151.4789: VXLAN, flags [I] (0x08), vni 4096
    10.100.1.151 > 10.100.1.148: ICMP 10.100.1.151 udp port 4789 unreachable, length 110
    10.100.1.148.58621 > 10.100.1.151.4789: VXLAN, flags [I] (0x08), vni 4096
    10.100.1.151.52433 > 10.100.1.148.2377: Flags [P.], cksum 0x186f (incorrect -> 0xe43f), seq 91551762:91551848, ack 2449959251, win 204, options [nop,nop,TS val 6053224 ecr 5791605], length 86
    10.100.1.148.2377 > 10.100.1.151.52433: Flags [P.], cksum 0xae76 (correct), seq 1:52, ack 86, win 330, options [nop,nop,TS val 5792111 ecr 6053224], length 51
    10.100.1.151.52433 > 10.100.1.148.2377: Flags [.], cksum 0x1819 (incorrect -> 0xceed), ack 52, win 204, options [nop,nop,TS val 6053224 ecr 5792111], length 0
    10.100.1.151.52433 > 10.100.1.148.2377: Flags [P.], cksum 0x183f (incorrect -> 0x999a), seq 86:124, ack 52, win 204, options [nop,nop,TS val 6053224 ecr 5792111], length 38
    10.100.1.148.2377 > 10.100.1.151.52433: Flags [P.], cksum 0x713f (correct), seq 52:119, ack 124, win 330, options [nop,nop,TS val 5792111 ecr 6053224], length 67
    10.100.1.151.52433 > 10.100.1.148.2377: Flags [P.], cksum 0x184c (incorrect -> 0xaeb6), seq 124:175, ack 119, win 204, options [nop,nop,TS val 6053224 ecr 5792111], length 51
    10.100.1.148.2377 > 10.100.1.151.52433: Flags [P.], cksum 0xe735 (correct), seq 119:157, ack 175, win 330, options [nop,nop,TS val 5792111 ecr 6053224], length 38
    10.100.1.151.52433 > 10.100.1.148.2377: Flags [.], cksum 0x1819 (incorrect -> 0xce27), ack 157, win 204, options [nop,nop,TS val 6053228 ecr 5792111], length 0
    10.100.1.148.7946 > 10.100.1.151.7946: UDP, length 58
```


I can see the ICMP packets that say "UDP port 4789 unreachable" though it is allowed on both nodes.

**Comment by tylerwight** [comment]
For the one person who comes to find answers, I ended up getting my project going. I got Kubernetes 100% working on 4 original kickstarter pine64's  3x 2gb ram 1x 1gb ram. I ended up doing it with Armbian, while I was working on this project Armbian released a new version for the Pine64 and it came with all the kernel modules I needed.

https://www.armbian.com/pine64/
