### ISSUE TITLE
Can't bind two containers to two network interfaces

### ISSUE THREAD

**Issue by andresgallo36** [docker/for-linux#38]
### Information
```
coreos1 ~ # cat /proc/version
Linux version 4.9.24-coreos (jenkins@localhost) (gcc version 4.9.4 (Gentoo Hardened 4.9.4 p1.0, pie-0.6.4) ) #1 SMP Tue May 30 23:12:01 UTC 2017
```

```
coreos1 ~ # cat /etc/os-release
NAME="Container Linux by CoreOS"
ID=coreos
VERSION=1353.8.0
VERSION_ID=1353.8.0
BUILD_ID=2017-05-30-2322
PRETTY_NAME="Container Linux by CoreOS 1353.8.0 (Ladybug)"
ANSI_COLOR="38;5;75"
HOME_URL="https://coreos.com/"
BUG_REPORT_URL="https://issues.coreos.com"
```

```
coreos1 ~ # docker version
Client:
 Version:      1.12.6
 API version:  1.24
 Go version:   go1.6.3
 Git commit:   d5236f0
 Built:        Tue May 30 23:15:08 2017
 OS/Arch:      linux/amd64

Server:
 Version:      1.12.6
 API version:  1.24
 Go version:   go1.6.3
 Git commit:   d5236f0
 Built:        Tue May 30 23:15:08 2017
 OS/Arch:      linux/amd64
```
Virtual Machine on Microsoft Azure

### Expected behavior
I have a host with two network interfaces and I need to create two containers, and bind each container to each other interface. 

The eth0 interface has the 10.0.1.4/24 inet address, and the eth1 interface has the 10.0.2.4/24 inet address. 

I'm able to bind the containers to their corresponding interfaces, but only one of them is able to correctly establish communication: I can correctly establish a TCP connection through eth0 to the first container but not through eth1 to the second container. 

I have defined the following routing tables: 
```
coreos1 ~ # cat /etc/iproute2/rt_tables
100 t1
101 t2
```

And I'm defining the following routes: 
```
ip route add default via 10.0.1.1 dev eth0 tab t1
ip rule add from 10.0.1.4 tab t1

ip route add default via 10.0.2.1 dev eth1 tab t2
ip rule add from 10.0.2.4 tab t2
```

I'm not sure if the problem is related to docker or to my routing tables and iptables setup, but I'm able to bind two different processes on the host, to the same TCP port and on each other interface, and correctly establish communication: 
```
coreos1 ~ # ncat -l 10.0.1.4 12340 &
coreos1 ~ # ncat -l 10.0.2.4 12340 &
```

I'm creating the containers with the following commands: 
```
docker run -d -t -p 10.0.1.4:12340:12340/tcp fedora/test /bin/bash -c "while true; do nc -l 12340; done"
docker run -d -t -p 10.0.2.4:12340:12340/tcp fedora/test /bin/bash -c "while true; do nc -l 12340; done"
```

The following is the iptables configuration generated after deploying the two containers: 
```
coreos1 ~ # iptables-save
# Generated by iptables-save v1.4.21 on Tue Jun 20 14:53:13 2017
*nat
:PREROUTING ACCEPT [0:0]
:INPUT ACCEPT [0:0]
:OUTPUT ACCEPT [10:712]
:POSTROUTING ACCEPT [10:712]
:DOCKER - [0:0]
-A PREROUTING -m addrtype --dst-type LOCAL -j DOCKER
-A OUTPUT ! -d 127.0.0.0/8 -m addrtype --dst-type LOCAL -j DOCKER
-A POSTROUTING -s 172.17.0.0/16 ! -o docker0 -j MASQUERADE
-A POSTROUTING -s 172.20.0.0/24 ! -o br-14488bbaaf8a -j MASQUERADE
-A POSTROUTING -s 172.17.0.2/32 -d 172.17.0.2/32 -p tcp -m tcp --dport 12340 -j MASQUERADE
-A POSTROUTING -s 172.17.0.2/32 -d 172.17.0.2/32 -p udp -m udp --dport 12340 -j MASQUERADE
-A POSTROUTING -s 172.17.0.3/32 -d 172.17.0.3/32 -p tcp -m tcp --dport 12340 -j MASQUERADE
-A POSTROUTING -s 172.17.0.3/32 -d 172.17.0.3/32 -p udp -m udp --dport 12340 -j MASQUERADE
-A DOCKER -i docker0 -j RETURN
-A DOCKER -i br-14488bbaaf8a -j RETURN
-A DOCKER -d 10.0.1.4/32 ! -i docker0 -p tcp -m tcp --dport 12340 -j DNAT --to-destination 172.17.0.2:12340
-A DOCKER -d 10.0.1.4/32 ! -i docker0 -p udp -m udp --dport 12340 -j DNAT --to-destination 172.17.0.2:12340
-A DOCKER -d 10.0.2.4/32 ! -i docker0 -p tcp -m tcp --dport 12340 -j DNAT --to-destination 172.17.0.3:12340
-A DOCKER -d 10.0.2.4/32 ! -i docker0 -p udp -m udp --dport 12340 -j DNAT --to-destination 172.17.0.3:12340
COMMIT
# Completed on Tue Jun 20 14:53:13 2017
# Generated by iptables-save v1.4.21 on Tue Jun 20 14:53:13 2017
*filter
:INPUT ACCEPT [39:7516]
:FORWARD ACCEPT [0:0]
:OUTPUT ACCEPT [46:4744]
:DOCKER - [0:0]
:DOCKER-ISOLATION - [0:0]
-A FORWARD -j DOCKER-ISOLATION
-A FORWARD -o docker0 -j DOCKER
-A FORWARD -o docker0 -m conntrack --ctstate RELATED,ESTABLISHED -j ACCEPT
-A FORWARD -i docker0 ! -o docker0 -j ACCEPT
-A FORWARD -i docker0 -o docker0 -j ACCEPT
-A FORWARD -o br-14488bbaaf8a -j DOCKER
-A FORWARD -o br-14488bbaaf8a -m conntrack --ctstate RELATED,ESTABLISHED -j ACCEPT
-A FORWARD -i br-14488bbaaf8a ! -o br-14488bbaaf8a -j ACCEPT
-A FORWARD -i br-14488bbaaf8a -o br-14488bbaaf8a -j ACCEPT
-A DOCKER -d 172.17.0.2/32 ! -i docker0 -o docker0 -p tcp -m tcp --dport 12340 -j ACCEPT
-A DOCKER -d 172.17.0.2/32 ! -i docker0 -o docker0 -p udp -m udp --dport 12340 -j ACCEPT
-A DOCKER -d 172.17.0.3/32 ! -i docker0 -o docker0 -p tcp -m tcp --dport 12340 -j ACCEPT
-A DOCKER -d 172.17.0.3/32 ! -i docker0 -o docker0 -p udp -m udp --dport 12340 -j ACCEPT
-A DOCKER-ISOLATION -i br-14488bbaaf8a -o docker0 -j DROP
-A DOCKER-ISOLATION -i docker0 -o br-14488bbaaf8a -j DROP
-A DOCKER-ISOLATION -j RETURN
COMMIT
# Completed on Tue Jun 20 14:53:13 2017
```

I'm using tcpdump from CoreOS toolbox and I get the following when I connecting through eth0: 
```
[root@coreos1 ~]# tcpdump -i any 'tcp port 12340'
tcpdump: verbose output suppressed, use -v or -vv for full protocol decode
listening on any, link-type LINUX_SLL (Linux cooked), capture size 262144 bytes
15:13:47.365862 IP dynamic-190-24-40-185.dynamic.etb.net.co.joltid > coreos1.12340: Flags [S], seq 1937941722, win 64240, options [mss 1412,nop,wscale 8,nop,nop,sackOK], length 0
15:13:47.365918 IP dynamic-190-24-40-185.dynamic.etb.net.co.joltid > 172.17.0.2.12340: Flags [S], seq 1937941722, win 64240, options [mss 1412,nop,wscale 8,nop,nop,sackOK], length 0
15:13:47.365924 IP dynamic-190-24-40-185.dynamic.etb.net.co.joltid > 172.17.0.2.12340: Flags [S], seq 1937941722, win 64240, options [mss 1412,nop,wscale 8,nop,nop,sackOK], length 0
15:13:47.365949 IP 172.17.0.2.12340 > dynamic-190-24-40-185.dynamic.etb.net.co.joltid: Flags [S.], seq 4012191503, ack 1937941723, win 29200, options [mss 1460,nop,nop,sackOK,nop,wscale 7], length 0
15:13:47.365949 IP 172.17.0.2.12340 > dynamic-190-24-40-185.dynamic.etb.net.co.joltid: Flags [S.], seq 4012191503, ack 1937941723, win 29200, options [mss 1460,nop,nop,sackOK,nop,wscale 7], length 0
15:13:47.365959 IP coreos1.12340 > dynamic-190-24-40-185.dynamic.etb.net.co.joltid: Flags [S.], seq 4012191503, ack 1937941723, win 29200, options [mss 1460,nop,nop,sackOK,nop,wscale 7], length 0
15:13:47.455636 IP dynamic-190-24-40-185.dynamic.etb.net.co.joltid > coreos1.12340: Flags [.], ack 1, win 259, length 0
15:13:47.455686 IP dynamic-190-24-40-185.dynamic.etb.net.co.joltid > 172.17.0.2.12340: Flags [.], ack 1, win 259, length 0
15:13:47.455692 IP dynamic-190-24-40-185.dynamic.etb.net.co.joltid > 172.17.0.2.12340: Flags [.], ack 1, win 259, length 0
15:13:49.167873 IP dynamic-190-24-40-185.dynamic.etb.net.co.joltid > coreos1.12340: Flags [P.], seq 1:2, ack 1, win 259, length 1
15:13:49.167920 IP dynamic-190-24-40-185.dynamic.etb.net.co.joltid > 172.17.0.2.12340: Flags [P.], seq 1:2, ack 1, win 259, length 1
15:13:49.167926 IP dynamic-190-24-40-185.dynamic.etb.net.co.joltid > 172.17.0.2.12340: Flags [P.], seq 1:2, ack 1, win 259, length 1
15:13:49.167948 IP 172.17.0.2.12340 > dynamic-190-24-40-185.dynamic.etb.net.co.joltid: Flags [.], ack 2, win 229, length 0
15:13:49.167948 IP 172.17.0.2.12340 > dynamic-190-24-40-185.dynamic.etb.net.co.joltid: Flags [.], ack 2, win 229, length 0
15:13:49.167958 IP coreos1.12340 > dynamic-190-24-40-185.dynamic.etb.net.co.joltid: Flags [.], ack 2, win 229, length 0
15:13:50.959042 IP dynamic-190-24-40-185.dynamic.etb.net.co.joltid > coreos1.12340: Flags [F.], seq 2, ack 1, win 259, length 0
15:13:50.959089 IP dynamic-190-24-40-185.dynamic.etb.net.co.joltid > 172.17.0.2.12340: Flags [F.], seq 2, ack 1, win 259, length 0
15:13:50.959096 IP dynamic-190-24-40-185.dynamic.etb.net.co.joltid > 172.17.0.2.12340: Flags [F.], seq 2, ack 1, win 259, length 0
15:13:50.959215 IP 172.17.0.2.12340 > dynamic-190-24-40-185.dynamic.etb.net.co.joltid: Flags [F.], seq 1, ack 3, win 229, length 0
15:13:50.959215 IP 172.17.0.2.12340 > dynamic-190-24-40-185.dynamic.etb.net.co.joltid: Flags [F.], seq 1, ack 3, win 229, length 0
15:13:50.959229 IP coreos1.12340 > dynamic-190-24-40-185.dynamic.etb.net.co.joltid: Flags [F.], seq 1, ack 3, win 229, length 0
15:13:51.050783 IP dynamic-190-24-40-185.dynamic.etb.net.co.joltid > coreos1.12340: Flags [.], ack 2, win 259, length 0
15:13:51.050829 IP dynamic-190-24-40-185.dynamic.etb.net.co.joltid > 172.17.0.2.12340: Flags [.], ack 2, win 259, length 0
15:13:51.050835 IP dynamic-190-24-40-185.dynamic.etb.net.co.joltid > 172.17.0.2.12340: Flags [.], ack 2, win 259, length 0
^C
24 packets captured
24 packets received by filter
0 packets dropped by kernel
```

But I get the following when connecting through eth1: 
```
[root@coreos1 ~]# tcpdump -i any 'tcp port 12340'
tcpdump: verbose output suppressed, use -v or -vv for full protocol decode
listening on any, link-type LINUX_SLL (Linux cooked), capture size 262144 bytes
15:14:41.747896 IP dynamic-190-24-40-185.dynamic.etb.net.co.data-port > coreos1.12340: Flags [S], seq 1579105937, win 64240, options [mss 1412,nop,wscale 8,nop,nop,sackOK], length 0
15:14:44.655098 IP dynamic-190-24-40-185.dynamic.etb.net.co.data-port > coreos1.12340: Flags [S], seq 1579105937, win 64240, options [mss 1412,nop,wscale 8,nop,nop,sackOK], length 0
15:14:50.626947 IP dynamic-190-24-40-185.dynamic.etb.net.co.data-port > coreos1.12340: Flags [S], seq 1579105937, win 64240, options [mss 1412,nop,wscale 8,nop,nop,sackOK], length 0
^C
3 packets captured
4 packets received by filter
0 packets dropped by kernel
```

An additional unexpected behavior is that when I add the following route to the main table: 
`ip route add default via 10.0.2.1 dev eth1`
The eth0 and eth1 behavior inverts: I can connect to the second container through eth1 but I can't connect to the first container through eth0. 

I have tried deploying the containers inside a separate network but there was no change, and I tried disabling the docker userland proxy but I also got the same result.

**Comment by andresgallo36** [comment]
I was able to fix this by changing most of the iptables rules, if someone is interested, my iptables now look like this: 

```
coreos1 ~ # iptables-save
# Generated by iptables-save v1.4.21 on Fri Aug  4 23:55:23 2017
*raw
:PREROUTING ACCEPT [102:12086]
:OUTPUT ACCEPT [43:4496]
COMMIT
# Completed on Fri Aug  4 23:55:23 2017
# Generated by iptables-save v1.4.21 on Fri Aug  4 23:55:23 2017
*mangle
:PREROUTING ACCEPT [102:12086]
:INPUT ACCEPT [38:7404]
:FORWARD ACCEPT [64:4682]
:OUTPUT ACCEPT [45:4792]
:POSTROUTING ACCEPT [109:9474]
-A PREROUTING -i eth0 -p tcp -m tcp --dport 12340 -j CONNMARK --set-xmark 0x1/0xffffffff
-A PREROUTING -i eth1 -p tcp -m tcp --dport 12340 -j CONNMARK --set-xmark 0x2/0xffffffff
-A PREROUTING -m connmark --mark 0x1 -j CONNMARK --restore-mark --nfmask 0xffffffff --ctmask 0xffffffff
-A PREROUTING -m connmark --mark 0x2 -j CONNMARK --restore-mark --nfmask 0xffffffff --ctmask 0xffffffff
COMMIT
# Completed on Fri Aug  4 23:55:23 2017
# Generated by iptables-save v1.4.21 on Fri Aug  4 23:55:23 2017
*nat
:PREROUTING ACCEPT [36:2937]
:INPUT ACCEPT [0:0]
:OUTPUT ACCEPT [7:484]
:POSTROUTING ACCEPT [43:3421]
:DOCKER - [0:0]
-A PREROUTING -s 10.0.1.4/32 -p tcp -m tcp --dport 12340 -j DNAT --to-destination 172.17.0.2:12340
-A PREROUTING -s 10.0.2.4/32 -p tcp -m tcp --dport 12340 -j DNAT --to-destination 172.17.0.3:12340
-A POSTROUTING ! -s 172.17.0.0/24 -d 172.17.0.2/32 -p tcp -m tcp --dport 12340 -j MASQUERADE
-A POSTROUTING ! -s 172.17.0.0/24 -d 172.17.0.3/32 -p tcp -m tcp --dport 12340 -j MASQUERADE
COMMIT
# Completed on Fri Aug  4 23:55:23 2017
# Generated by iptables-save v1.4.21 on Fri Aug  4 23:55:23 2017
*filter
:INPUT ACCEPT [38:7404]
:FORWARD ACCEPT [64:4682]
:OUTPUT ACCEPT [52:7744]
:DOCKER - [0:0]
:DOCKER-ISOLATION - [0:0]
COMMIT
# Completed on Fri Aug  4 23:55:23 2017
```
