### ISSUE TITLE
All pushes hang on Red Hat 7.4 system under web proxy

### ISSUE THREAD

**Issue by AlexS825** [docker/for-linux#203]
* [x] This is a bug report
* [ ] This is a feature request
* [x] I searched existing issues before opening this one

### Expected behavior

We expect the execution of a 'docker push' to the docker.io registry to succeed, where docker is installed on a Red Hat Enterprise Linux machine in a corporate network needing to use a web proxy to access the external internet.  The proxy is a Forcepoint (previously Websense) web proxy.

Docker pulls - runs, builds, etc - work through the proxy, downloading images with no problems from the docker.io registry.  However all pushes to the registry fail.

### Actual behavior

All pushes through the proxy to the docker.io registry hang, even the push of a 'tiny' image listed as being only 3.46kB in size. 

### Steps to reproduce the behavior

All 'docker push' commands to push images to the docker.io registry hang.

Output from a push command for a 3.46kB 'tiny' image is below:

```
# docker push REDACTED_USER/tiny
The push refers to repository [docker.io/REDACTED_USER/tiny]
c5260d479202: Pushing [==================================================>]  6.656kB
7bfca29bb3c5: Waiting
f999ae22f308: Waiting
```

The push will 'hang' for 30 seconds showing the above before the 'Pushing' line will change to 'retrying', do a countdown and then try again.

**Output of `docker version`:**

```
Client:
 Version:       17.12.0-ce
 API version:   1.35
 Go version:    go1.9.2
 Git commit:    c97c6d6
 Built: Wed Dec 27 20:10:14 2017
 OS/Arch:       linux/amd64

Server:
 Engine:
  Version:      17.12.0-ce
  API version:  1.35 (minimum version 1.12)
  Go version:   go1.9.2
  Git commit:   c97c6d6
  Built:        Wed Dec 27 20:12:46 2017
  OS/Arch:      linux/amd64
  Experimental: false
```

**Output of `docker info`:**

```
Containers: 3
 Running: 0
 Paused: 0
 Stopped: 3
Images: 12
Server Version: 17.12.0-ce
Storage Driver: overlay2
 Backing Filesystem: xfs
 Supports d_type: true
 Native Overlay Diff: true
Logging Driver: json-file
Cgroup Driver: cgroupfs
Plugins:
 Volume: local
 Network: bridge host macvlan null overlay
 Log: awslogs fluentd gcplogs gelf journald json-file logentries splunk syslog
Swarm: inactive
Runtimes: runc
Default Runtime: runc
Init Binary: docker-init
containerd version: 89623f28b87a6004d4b785663257362d1658a729
runc version: b2567b37d7b75eb4cf325b77297b140ea686ce8f
init version: 949e6fa
Security Options:
 seccomp
  Profile: default
Kernel Version: 3.10.0-693.11.6.el7.x86_64
Operating System: Red Hat Enterprise Linux Server 7.4 (Maipo)
OSType: linux
Architecture: x86_64
CPUs: 4
Total Memory: 15.51GiB
Name: REDACTED_CLIENT_HOSTNAME
ID: KQZH:HUPL:7BDZ:GGHM:AQQD:AADG:VAZX:STZH:XEVD:MN6P:OB3J:XTSK
Docker Root Dir: /var/lib/docker
Debug Mode (client): false
Debug Mode (server): false
HTTP Proxy: http://REDACTED_PROXY_USER:REDACTED_PROXY_PASSWORD@REDACTED_PROXY_HOSTNAME:8080/
HTTPS Proxy: https://REDACTED_PROXY_USER:REDACTED_PROXY_PASSWORD@REDACTED_PROXY_HOSTNAME:8080/
No Proxy: localhost,127.0.0.*,172.17.*.*,10.*,192.168.*
Username: REDACTED_USER
Registry: https://index.docker.io/v1/
Labels:
Experimental: false
Insecure Registries:
 127.0.0.0/8
Live Restore Enabled: false
```

**Additional environment details (AWS, VirtualBox, physical, etc.)**

Docker is running on a Red Hat Enterprise Linux 7.4 machine underneath a Forcepoint (previously Websense) web proxy.  This problem occurs with the following docker versions:

*  Red Hat docker 1.12.6 (downloaded from Red Hat 'extras' repository)
*  Centos docker 1.12.6 (downloaded from Centos repository)
*  The Docker CE image from docker.io (RPM docker-ce-17.12.0.ce-1.el7.centos.x86_64).

HTTP_PROXY and HTTPS_PROXY environment variables were set in /etc/docker/daemon.json; they can be seen in the output of the 'docker info' command above.

The Forcepoint web proxy does 'man in the middle' inspection of HTTPS traffic, substituting its own certificates.  The proxy's CA certificate was installed in the /etc/pki/ca-trust directory so the Red Hat Linux system would accept certificates from external HTTPS sites.

After this configuration for the proxy was done docker worked perfectly when downloading images from docker.io.  'docker run hello-world' worked fine.  The docker build from the 'Getting Started' tutorial - doing a pull of the python:2.7-slim image from docker.io - worked perfectly.  No problem with downloads through the proxy at all.

But a push of even the smallest image to docker.io hangs.

A tcpdump shows this traffic leading into the hang:

```
#       Client sends a packet and proxy Acks.

16:02:26.307761 IP client.35226 > proxy.webcache: Flags [P.], seq 326:484, ack 3372, win 36500, length 158: HTTP
16:02:26.308897 IP proxy.webcache > client.35226: Flags [.], ack 484, win 17688, length 0

#       Proxy sends two packets and client ACKs.

16:02:26.319236 IP proxy.webcache > client.35226: Flags [P.], seq 3372:3378, ack 484, win 17688, length 6: HTTP
16:02:26.319261 IP proxy.webcache > client.35226: Flags [P.], seq 3378:3423, ack 484, win 17688, length 45: HTTP
16:02:26.319344 IP client.35226 > proxy.webcache: Flags [.], ack 3423, win 36500, length 0

#       The point where they hang.  Client sends three packets, proxy sends two ACKs back (covering everything the client has sent) but then they hang for 30 seconds.

16:02:26.319569 IP client.35226 > proxy.webcache: Flags [P.], seq 484:1692, ack 3423, win 36500, length 1208: HTTP
16:02:26.319592 IP client.35226 > proxy.webcache: Flags [P.], seq 1692:3680, ack 3423, win 36500, length 1988: HTTP
16:02:26.319610 IP client.35226 > proxy.webcache: Flags [P.], seq 3680:3714, ack 3423, win 36500, length 34: HTTP
16:02:26.321168 IP proxy.webcache > client.35226: Flags [.], ack 3680, win 23360, length 0
16:02:26.360235 IP proxy.webcache > client.35226: Flags [.], ack 3714, win 23360, length 0

#       After 30 seconds both sides transmit their last ACK.

16:02:56.360433 IP client.35226 > proxy.webcache: Flags [.], ack 3423, win 36500, length 0
16:02:56.361519 IP proxy.webcache > client.35226: Flags [.], ack 3714, win 23360, length 0

#       Another 30 seconds and they both retransmit again.

16:03:26.440474 IP client.35226 > proxy.webcache: Flags [.], ack 3423, win 36500, length 0
16:03:26.443127 IP proxy.webcache > client.35226: Flags [.], ack 3714, win 23360, length 0
```

After a few 30-second timeouts in the packet sniff the CLI will announce a 'retry' and the dockerd log reports to syslog an error with the message "Upload failed, retrying: EOF".

I've tried three different versions of docker, different MTU sizes (800, 1500 & 2500), but a push has never succeeded.  I am in corporate environment of a large company; the Forcepoint proxy is in live production use and working with no other issues.
